Sheet: Sheet1
A1: . | O1: . | P1: .
A2: 2 | C2: of:="AV Evangard Stylesheet Generator v"&RIGHT(YEAR(NOW());2)&RIGHT("0"&MONTH(NOW());2) -> AV Evangard Stylesheet Generator v2212
A3: 3 | C3: Configuration file
A4: 4 | C4: of:="Body Text: "&[.$D$7]&"/"&[.$D$26]&" | L4: "&['file:///mnt/stuff/Google/AV%20Projects/0-ParkingLot/Method%5BAV-LO%5DEvangard/Github/AV-Evangard/Calc/Config%20Files/Evangard.fods'#$'Base Pts'.$H$20]&"/"&['file:///mnt/stuff/Google/AV%20Projects/0-ParkingLot/Method%5BAV-LO%5DEvangard/Github/AV-Evangard/Calc/Config%20Files/Evangard.fods'#$'Base Pts'.$I$20]&" | L9: "&['file:///mnt/stuff/Google/AV%20Projects/0-ParkingLot/Method%5BAV-LO%5DEvangard/Github/AV-Evangard/Calc/Config%20Files/Evangard.fods'#$'Base Pts'.$H$25]&"/"&['file:///mnt/stuff/Google/AV%20Projects/0-ParkingLot/Method%5BAV-LO%5DEvangard/Github/AV-Evangard/Calc/Config%20Files/Evangard.fods'#$'Base Pts'.$I$25]&" page: "&[.D20]&" x "&[.D21] -> Body Text: 10/10.6 | L4: 16.8/21.2 | L9: 40/53 page: 152.4 x 228.6
A6: 6 | C6: Basic Layout
A7: 7 | C7: Pt Size | D7: 10 | G7: Pt Size by page dim
A8: 8 | C8: Leading Ratio | D8: 1.06 | E8: Multiplier for leading | G8: 55 | H8: Number of text Rows
A9: 9 | C9: Scaling Ratio | D9: of:=POWER(2;1/4) -> 1.18920711500272 | E9: Text Levels Increase by this | G9: of:=(([.D21]/25.4*72)-([.D23]*2)-(([.D45]+[.D43]+[.D43])*[.D38])-(([.D56]+[.D54]+[.D54])*[.D49]))/[.G8]/[.D8] -> 9.77015437392796 | H9: Base pt size
A10: 10
A11: 11 | C11: Body Text Columns? | D11: 2 | E11: Body Text columns | G11: Bit level settings
A12: 12 | C12: Justify? | D12: 2 | E12: of:="[0-3] "&IF(ISEVEN([.D12]);"Strictly ";"Optically ")&IF([.D12]>1;"Justified";"Ragged") -> [0-3] Strictly Justified | G12: of:=DEC2BIN([.D12];5) -> 00010 | H12: of:=LEFT([.G12];1) -> 0 | I12: of:=MID([.G12];2;1) -> 0 | J12: of:=MID([.G12];3;1) -> 0 | K12: of:=MID([.G12];4;1) -> 1 | L12: of:=RIGHT([.G12];1) -> 0
A13: 13 | C13: Hyphenate? | D13: 1 | E13: of:=IF([.D13]=1;"(1=YES): 0=No";"1=Yes: (0=NO)") -> (1=YES): 0=No | G13: of:=DEC2BIN([.D13];5) -> 00001 | H13: of:=LEFT([.G13];1) -> 0 | I13: of:=MID([.G13];2;1) -> 0 | J13: of:=MID([.G13];3;1) -> 0 | K13: of:=MID([.G13];4;1) -> 0 | L13: of:=RIGHT([.G13];1) -> 1
A14: 14 | C14: Ligatures? | D14: 1 | E14: of:="[0-15] "&IF([.I14]="1";"(hlig) ";" hlig ")&IF([.J14]="1";"(clig) ";" clig ")&IF([.K14]="1";"(dlig) ";" dlig ")&IF([.L14]="1";"(liga) ";" liga ") -> [0-15]  hlig  clig  dlig (liga)  | G14: of:=DEC2BIN([.D14];5) -> 00001 | H14: of:=LEFT([.G14];1) -> 0 | I14: of:=MID([.G14];2;1) -> 0 | J14: of:=MID([.G14];3;1) -> 0 | K14: of:=MID([.G14];4;1) -> 0 | L14: of:=RIGHT([.G14];1) -> 1
A15: 15 | C15: Figure Style? | D15: 3 | E15: of:="[0-3] "&IF(ISODD([.D15]);"Proportional ";"Tabular ")&IF([.D15]<2;"Oldstyle";"Lining") -> [0-3] Proportional Lining | G15: of:=DEC2BIN([.D15];5) -> 00011 | H15: of:=LEFT([.G15];1) -> 0 | I15: of:=1-(VALUE(MID([.G15];5;1))) -> 0 | J15: of:=1-(VALUE(MID([.G15];4;1))) -> 0 | K15: of:=MID([.G15];4;1) -> 1 | L15: of:=RIGHT([.G15];1) -> 1
A16: 16 | C16: Drop Caps? | D16: 2 | E16: Text rows
A17: 17 | C17: Run-in Scripture Books? | D17: 1 | E17: of:="[0-1] "&IF([.D17]=0;"Page";"Section")&" break at id tag" -> [0-1] Section break at id tag
A19: 19 | C19: Page Dimensions
A20: 20 | C20: X page | D20: 152.4 | E20: mm | G20: of:=[.D20]/25.4 -> 6 | H20: x | I20: of:=[.D21]/25.4 -> 9 | L20: of:=[.D20]/25.4*72 -> 432
A21: 21 | C21: Y page | D21: 228.6 | E21: mm | G21: Page Info | L21: of:=ROUND([.D21]/25.4*72) -> 648
A22: 22 | C22: Inside edge | D22: of:=18/32*72 -> 40.5 | E22: pt | G22: 2.75 | H22: Char Density (char/em)
A23: 23 | C23: Outside Edges | D23: of:=7/16*72 -> 31.5 | E23: pt | G23: of:=(([.$D$20]/25.4*72)-([.$D$22]+[.$D$23]+[.$D$25]*([.$D$11]-1)))/[.$D$11] -> 173.697202290486 | H23: Text row (pts) | L23: of:=[.L20]-[.D22]-[.D23] -> 360
A24: 24 | G24: of:=INT([.G23]/[.$D$26]*[.G22]) -> 45 | H24: Text row (chars)
A25: 25 | C25: Column gutter | D25: of:=[.D7]*[.D9]*[.D8] -> 12.6055954190288 | E25: pt | G25: of:=(([.$D$21]/25.4*72-2*[.$D$23]-[.$D$45]*[.$D$38]-[.$D$56]*[.$D$49])/[.$D$26])*[.$D$11] -> 107.849056603774 | H25: Text rows/page | L25: of:=INT(([.D21]/25.4*72)-2*[.D23]-([.D45]+[.D43]*2)-([.D56]+2*[.D54])) -> 554
A26: 26 | C26: Embox | D26: of:=INT([.D7]*[.D8]*10)/10 -> 10.6 | E26: pt^2 | G26: of:=[.G24]*[.G25]/5*0.9 -> 873.577358490566 | H26: words/page
A27: 27 | C27: Registration Ref Style | D27: m | G27: of:=760000/[.G26]*1.1 -> 956.984509585396 | H27: Estimated Text Bible
A28: 28
A31: 31 | C31: Page Background
A32: 32 | C32: Background Type | D32: none | E32: [none, solid,bitmap]
A33: 33 | C33: Background Color | D33: ffffff | E33: [HTML Color] | L33: of:=RIGHT("000000"&[.$D$33];6) -> ffffff
A34: 34 | C34: Background Image | E34: [name] (not implemented.)
A35: 35 | C35: Background Transparency | D35: 30 | E35: %
A37: 37 | C37: Header/Footer Options
A38: 38 | C38: Header? | D38: 1 | E38: [0,1]
A39: 39 | C39: Same Content L & R | D39: 0 | E39: of:="[0,1] "&IF([.D39]=0;"Mirrored";"Single")&" Header" -> [0,1] Mirrored Header
A40: 40 | C40: Same Content First Page | D40: 0 | E40: [0,1]
A41: 41 | C41: Left Margin | D41: 0 | E41: pts
A42: 42 | C42: Right Margin | D42: 0 | E42: pts
A43: 43 | C43: Spacing Above & Below | D43: 1 | E43: pts
A44: 44 | C44: Dynamic Spacing | D44: 1 | E44: of:="[0,1] Header grows into "&IF([.D44]=1;"text ";"header ")&"area." -> [0,1] Header grows into text area. | L44: of:=IF([.D44]=1;"true";"false") -> true
A45: 45 | C45: Height | D45: of:=(INT([.$D$7]*[.$D$8]*10)/10+2*[.$D$43])+([.$D$62]*SUM(VALUE([.$I$65]);VALUE([.$J$65]))) -> 13.4 | E45: pts
A46: 46 | C46: Header/Footer Text Style | D46: ms9
A47: 47 | C47: Single/Odd Header Text | D47: <text:variable-get text:name="h1"/><text:tab/><text:page-number text:select-page="current">0</text:page-number><text:tab/><text:variable-get text:name="h"/><text:s/><text:variable-get text:name="cn"/>
A48: 48 | C48: Even Header Text | D48: <text:variable-get text:name="h"/><text:s/><text:variable-get text:name="cn"/><text:tab/><text:page-number text:select-page="current">0</text:page-number><text:tab/><text:variable-get text:name="h0"/>
A49: 49 | C49: Footer? | D49: 0 | E49: [0,1]
A50: 50 | C50: Same Content L & R | D50: 0 | E50: [0,1]
A51: 51 | C51: Same Content First Page | D51: 0 | E51: [0,1]
A52: 52 | C52: Left Margin | D52: 0 | E52: pts
A53: 53 | C53: Right Margin | D53: 0 | E53: pts
A54: 0 | C54: Spacing Above & Below | D54: 1 | E54: pts
A55: 55 | C55: Dynamic Spacing | D55: 1 | E55: of:="[0,1] Footer grows into "&IF([.D55]=1;"text ";"footer ")&"area." -> [0,1] Footer grows into text area. | L55: of:=IF([.D55]=1;"true";"false") -> true
A56: 56 | C56: Height | D56: of:=(INT([.$D$7]*[.$D$8]*10)/10+2*[.$D$43])+([.$D$62]*SUM(VALUE([.$I$66]);VALUE([.$J$66]))) -> 13.4
A57: 57 | C57: Single/Odd Footer Text | D57: <text:tab/><text:page-number text:select-page="current">0</text:page-number><text:tab/><text:variable-get text:name="h"/><text:s/><text:variable-get text:name="cn"/>
A58: 58 | C58: Even Footer Text | D58: <text:page-number text:select-page="current">0</text:page-number><text:tab/><text:tab/><text:variable-get text:name="h4"/><text:s/>
A59: 59 | C59: Separator Options
A60: 60 | C60: Default Separator Style | D60: 1 | E60: of:="(0-3): "&[.D60]&"-"&IF([.D60]=1;"LINE";IF([.D60]=2;"DOTTED";IF([.D60]=3;" DASH";" NONE"))) -> (0-3): 1-LINE | L60: of:=IF([.D60]=1;"solid";IF([.D60]=2;"dotted";IF([.D60]=3;" dashed";" none"))) -> solid
A61: 61 | C61: Separator Color | D61: c0c0c0 | E61: [HTML Color] | L61: of:=RIGHT("000000"&[.$D61];6) -> c0c0c0
A62: 62 | C62: Separator weight | D62: 0.8 | E62: pts
A63: 63 | G63: Bit level | I63: T | J63: B | K63: R | L63: L
A64: 64 | C64: Page Frame | D64: 8 | E64: of:="[0-15] "&IF([.$I64]="1";"T";"")&IF([.$J64]="1";"B";"")&IF([.$K64]="1";"L";"")&IF([.$L64]="1";"R";"") -> [0-15] T | G64: of:=DEC2BIN([.D64];5) -> 01000 | I64: of:=MID([.G64];2;1) -> 1 | J64: of:=MID([.G64];3;1) -> 0 | K64: of:=MID([.G64];4;1) -> 0 | L64: of:=RIGHT([.G64];1) -> 0
A65: 65 | C65: Header Frame | D65: 4 | E65: of:="[0-15] "&IF([.$I65]="1";"T";"")&IF([.$J65]="1";"B";"")&IF([.$K65]="1";"L";"")&IF([.$L65]="1";"R";"") -> [0-15] B | G65: of:=DEC2BIN([.D65];5) -> 00100 | I65: of:=MID([.G65];2;1) -> 0 | J65: of:=MID([.G65];3;1) -> 1 | K65: of:=MID([.G65];4;1) -> 0 | L65: of:=RIGHT([.G65];1) -> 0
A66: 66 | C66: Footer Frame | D66: 8 | E66: of:="[0-15] "&IF([.$I66]="1";"T";"")&IF([.$J66]="1";"B";"")&IF([.$K66]="1";"L";"")&IF([.$L66]="1";"R";"") -> [0-15] T | G66: of:=DEC2BIN([.D66];5) -> 01000 | I66: of:=MID([.G66];2;1) -> 1 | J66: of:=MID([.G66];3;1) -> 0 | K66: of:=MID([.G66];4;1) -> 0 | L66: of:=RIGHT([.G66];1) -> 0
A67: 67 | C67: Column Separator | D67: 1 | E67: of:="[0-1] "&IF([.$I67]="1";"T";"")&IF([.$J67]="1";"B";"")&IF([.$K67]="1";"L";"")&IF([.$L67]="1";"R";"") -> [0-1] R | G67: of:=DEC2BIN([.D67];5) -> 00001 | I67: of:=MID([.G67];2;1) -> 0 | J67: of:=MID([.G67];3;1) -> 0 | K67: of:=MID([.G67];4;1) -> 0 | L67: of:=RIGHT([.G67];1) -> 1
A68: 68 | C68: Foonote Separator | D68: 8 | E68: of:="[0-15] "&IF([.$I68]="1";"T";"")&IF([.$J68]="1";"B";"")&IF([.$K68]="1";"L";"")&IF([.$L68]="1";"R";"") -> [0-15] T | G68: of:=DEC2BIN([.D68];5) -> 01000 | I68: of:=MID([.G68];2;1) -> 1
A71: 71 | C71: Drop Cap Options
A72: 72 | C72: Drop Cap Lines | D72: of:=[.$D$16] -> 2 | E72: Rows (from basic settings above)
A73: 73 | C73: Drop Cap Chars | D73: word | E73: of:="[""word"", ""n""] "&IF(ISNUMBER([.D73]);[.D73]&" character";"1st word")&" will drop." -> ["word", "n"] 1st word will drop.
A74: 74 | C74: Drop Cap Gap | D74: 4pt
A75: 75 | C75: Text Style | D75: ca
A77: 77 | C77: Footnote Options
A78: 78 | C78: Anchor Style | D78: fk
A79: 79 | C79: Symbol Style | D79: +
A80: 80 | C80: Symbol type | D80: a | E80: [a, A, 1, i, I ]
A81: 81 | C81: Numbering restarts | D81: page | E81: [document, chapter, page]
A82: 82 | C82: Min Gap | D82: default | E82: ["default", "n"pts] | L82: of:=IF(ISNUMBER([.$D$82]);[.$D$82];['file:///mnt/stuff/Google/AV%20Projects/0-ParkingLot/Method%5BAV-LO%5DEvangard/Github/AV-Evangard/Calc/Config%20Files/Evangard.fods'#$'Base Pts'.I28]) -> 5.3
A83: 83 | C83: Max footnote area | D83: page | E83: ["page", "n"pts] | L83: of:=IF(ISNUMBER([.$D$83]);[.$D$82];0) -> 0
A84: 84 | C84: Text before marker
A85: 85 | C85: Text After marker | D85: :
A86: 86 | C86: Continuation from
A87: 87 | C87: Continuation receive
A88: 88 | C88: Marker vertical shift | D88: 0.25 | E88: [multiplier]
A89: 89 | C89: Marker scale | D89: 0.75 | E89: [multiplier]
A90: 90
A92: 92 | C92: Endnote Options
A93: 93 | C93: Anchor Style | D93: xk
A94: 94 | C94: Symbol Style | D94: +
A95: 95 | C95: Symbol type | D95: i | E95: [a, A, 1, i, I ]
A96: 96 | C96: Start at | D96: 1 | E96: [n]
A97: 97 | C97: Text before marker
A98: 98 | C98: Text After marker
A99: 99
A101: 101 | C101: Verse Marker Options
A102: 102 | C102: Marker vertical shift | D102: 0.16 | E102: [multiplier]
A103: 103 | C103: Marker scale | D103: 0.7 | E103: [multiplier]
A104: 104 | C104: Space After | D104: of:=1/SQRT(2) -> 0.707106781186547 | E104: [multiplier] not implemented
A105: 105
A107: 107 | C107: Index/Table of Contents Options
A108: 108 | C108: Entry Style | D108: im
A109: 109 | C109: Link Style | D109: im
A110: 110 | C110: Leader Style | D110: .
A111: 111
A115: 115 | C115: Advanced Composition
A116: 116 | C116: Language Settings
A117: 117 | C117: Western Language | D117: en | E117: ISO639
A118: 118 | C118: Western Country | D118: us | E118: ISO3166
A119: 119 | C119: Asian Language | D119: zh | E119: ISO639
A120: 120 | C120: Asian Country | D120: cn | E120: ISO3166
A121: 121 | C121: CTL Language | D121: hi | E121: ISO639 | F121: LibreOffice 7.4 Composition Settings
A122: 122 | C122: CTL Country | D122: in | E122: ISO3166 | F122: Keep across page | L122: page | M122: of:=IF([.L122]=1;"true";"false") -> false
A123: 123 | C123: Hyphenation Options | F123: Keep last word | L123: 1 | M123: of:=IF([.L123]=1;"true";"false") -> true
A124: 124 | C124: Keep before split | D124: 3 | E124: Letters | F124: Keep ALLCAP words | L124: 1 | M124: of:=IF([.L124]=1;"true";"false") -> true
A125: 125 | C125: Keep after split | D125: 3 | E125: Letters | F125: Keep min word | L125: 6 | M125: Letters
A126: 126 | C126: Max consecutive | D126: 2 | E126: Rows | F126: Hyphenation Zone | L126: of:=INT([.$G$23]/3)*20 -> 1140 | N126: mEm
A127: 127 | C127: Composition Options
A128: 128 | C128: Legacy Spacing | D128: 0 | E128: of:="[0,1] "&IF([.D128]=1;"Legacy ";"Common ")&"Spacing active." -> [0,1] Common Spacing active. | L128: of:=IF([.D128]=1;"true";"false") -> false
A129: 129 | C129: Legacy Wrapping | D129: 0 | E129: of:="[0,1] "&IF([.D129]=1;"Legacy ";"Common ")&"Wrap active." -> [0,1] Common Wrap active. | L129: of:=IF([.D129]=1;"true";"false") -> false
A130: 130 | C130: Legacy Positioning | D130: 0 | E130: of:="[0,1] "&IF([.D130]=1;"Legacy ";"Common ")&"Pos active." -> [0,1] Common Pos active. | L130: of:=IF([.D130]=1;"true";"false") -> false
A131: 131 | C131: Legacy Print Metrics | D131: 0 | E131: of:="[0,1] "&IF([.D131]=1;"Legacy ";"Common ")&"Print active." -> [0,1] Common Print active. | L131: of:=IF([.D131]=1;"true";"false") -> false
A132: 132 | C132: Printer Independent Layout | D132: high-resolution | E132: ? | F132: Orphan keep rows @ bot | L132: 2 | M132: Lines
A133: 133 | C133: Character Compression | D133: 1 | E133: ? | F133: Widow keep rows @ top | L133: 2 | M133: Lines | N133: Lines
A134: 134 | C134: Asian Punctuation | D134: 1 | E134: [0,1] | L134: of:=IF([.D134]=1;"true";"false") -> true
A135: 135 | C135: Force Black Text | D135: 1 | E135: [0,1] | L135: of:=IF([.D135]=1;"true";"false") -> true
A136: 136 | C136: Print Empty Pages | D136: 1 | E136: [0,1] | L136: of:=IF([.D136]=1;"true";"false") -> true
A137: 137 | C137: Text Direction | D137: lr-tb
A138: 138 | C138: Global OpenType Options | G138: Bit Level Settings
A139: 139 | C139: Auto Kerning (kern) | D139: 1 | E139: of:=IF([.D139]=1;"(1=YES): 0=No";"1=Yes: (0=NO)") -> (1=YES): 0=No | G139: of:=DEC2BIN([.D139];5) -> 00001 | H139: of:=LEFT([.G139];1) -> 0 | I139: of:=MID([.G139];2;1) -> 0 | J139: of:=MID([.G139];3;1) -> 0 | K139: of:=MID([.G139];4;1) -> 0 | L139: of:=RIGHT([.G139];1) -> 1
A140: 140 | C140: Text aligns to | D140: baseline | E140: top, baseline, middle, bottom, auto
A141: 141 | C141: Spacing Options | D141: 31 | E141: of:="[0-31] "&IF(LEFT([.G141];1)="1";"(cpsp) ";" cpsp ")&IF(MID([.G141];2;1)="1";"(fwid) ";" fwid ")&IF(MID([.G141];3;1)="1";"(opbd) ";" opbd ")&IF(MID([.G141];4;1)="1";"(rtbd) ";" rtbd ")&IF(RIGHT([.G141];1)="1";"(lfbd) ";" lfbd ") -> [0-31] (cpsp) (fwid) (opbd) (rtbd) (lfbd)  | G141: of:=DEC2BIN([.D141];5) -> 11111 | H141: of:=LEFT([.G141];1) -> 1 | I141: of:=MID([.G141];2;1) -> 1 | J141: of:=MID([.G141];3;1) -> 1 | K141: of:=MID([.G141];4;1) -> 1 | L141: of:=RIGHT([.G141];1) -> 1
A142: 142 | C142: Contextual Alternates | D142: 0 | E142: of:=IF([.D142]=1;"(1=YES): 0=No";"1=Yes: (0=NO)") -> 1=Yes: (0=NO) | G142: of:=DEC2BIN([.D142];5) -> 00000 | H142: of:=LEFT([.G142];1) -> 0 | I142: of:=MID([.G142];2;1) -> 0 | J142: of:=MID([.G142];3;1) -> 0 | K142: of:=MID([.G142];4;1) -> 0 | L142: of:=RIGHT([.G142];1) -> 0
A143: 143
A144: 144
A146: 146 | C146: File Configuration Options
A147: 147 | C147: USFM Compability
A148: 148 | C148: Short Style names | D148: 1 | E148: of:="[0,1] "&IF([.D148]=0;"Long ";"Short ")&"style names active."&IF([.D148]=1;" ParaText compatible.";"") -> [0,1] Short style names active. ParaText compatible. | L148: of:=IF([.D148]=1;"true";"false") -> true
A149: 147

Sheet: 'file:///mnt/stuff/Google/AV%20Projects/0-ParkingLot/Method%5BAV-LO%5DEvangard/Github/AV-Evangard/Calc/Config%20Files/Evangard.fods'#Base Pts
H20: 16.8 | I20: 21.2
H25: 40 | I25: 53
I28: 5.3

Sheet: 'file:///mnt/stuff/Google/AV%20Projects/0-ParkingLot/Method%5BAV-LO%5DEvangard/Github/AV-Evangard/Calc/Config%20Files/Evangard.fods'#Frequency
J2: 2.591163327547

Sheet: 'file:///mnt/stuff/Google/AV%20Projects/0-ParkingLot/Method%5BAV-LO%5DEvangard/Github/AV-Evangard/Calc/Config%20Files/Evangard.fods'#Base Pts
H20: 16.8 | I20: 21.2
H25: 40 | I25: 53
I28: 5.3